{
  "schema": "growth-loop/case/v1",
  "id": "case-2026-03-04-001",
  "persona": "robin",
  "created": "2026-03-04T15:20:00Z",
  "from_signals": [
    "sig-2026-03-04-001"
  ],
  "area": "communication",
  "situation": "A parent asks to move a student's quiz because of a family trip.",
  "expected": "Offer one make-up slot in the same week, then point to the policy for anything later.",
  "match": "rubric",
  "status": "new"
}
